{
  "schema_id": "emergentism/FourthChurningCorpus.v1",
  "release_id": "FOURTH-CHURNING-2026-08-24",
  "date": "2026-08-24",
  "authorship": "Yves R. Burri",
  "ai_assistance": "AI systems assisted with candidate generation, adversarial review, implementation, and testing; Yves R. Burri remains the human author.",
  "license": "CC BY-SA 4.0",
  "relation_to_third": "ADDITIVE_OVERLAY",
  "third_churning_immutable": true,
  "input_hashes": [
    {
      "path": "14_THE_DISTILLATION/07_THE_THIRD_CHURNING_2026_08_23/data/problem_adjudications.v1.json",
      "sha256": "7618139f3ab376c017ececaa64c88e33c097cdb0efd245f3b2453f65d78c4b8a"
    },
    {
      "path": "00_META/internal_answers/EmergentistAnswerSet.v1.json",
      "sha256": "6740318328462043d5f5de14a6e539a421b35ebfbffbe8060022e12f7c4e8c89"
    }
  ],
  "schema_paths": {
    "collision": "14_THE_DISTILLATION/08_THE_FOURTH_CHURNING_2026_08_24/contracts/TypeCollision.v1.schema.json",
    "diagnosis": "14_THE_DISTILLATION/08_THE_FOURTH_CHURNING_2026_08_24/contracts/MysteryDiagnosis.v1.schema.json",
    "corpus": "14_THE_DISTILLATION/08_THE_FOURTH_CHURNING_2026_08_24/contracts/FourthChurningCorpus.v1.schema.json"
  },
  "diagnosis_order": [
    "MTA54@1:MET:GROUND",
    "MTA54@1:MET:ONE_MANY",
    "MTA54@1:MET:UNIVERSALS",
    "MTA54@1:MET:IDENTITY",
    "MTA54@1:MET:MODALITY",
    "MTA54@1:MET:TIME",
    "MTA54@1:EPI:EXTERNAL_WORLD",
    "MTA54@1:EPI:INDUCTION",
    "MTA54@1:EPI:GETTIER",
    "MTA54@1:EPI:APRIORI",
    "MTA54@1:EPI:TESTIMONY",
    "MTA54@1:EPI:DISAGREEMENT",
    "MTA54@1:LOG:LIAR",
    "MTA54@1:LOG:RUSSELL",
    "MTA54@1:LOG:GODEL",
    "MTA54@1:LOG:SORITES",
    "MTA54@1:LOG:REFERENCE",
    "MTA54@1:LOG:RULE_FOLLOWING",
    "MTA54@1:MIN:MIND_BODY",
    "MTA54@1:MIN:CONSCIOUSNESS",
    "MTA54@1:MIN:INTENTIONALITY",
    "MTA54@1:MIN:PERSONAL_IDENTITY",
    "MTA54@1:MIN:FREE_WILL",
    "MTA54@1:MIN:OTHER_MINDS",
    "MTA54@1:SCI:CAUSATION",
    "MTA54@1:SCI:LAWS",
    "MTA54@1:SCI:EMERGENCE",
    "MTA54@1:SCI:MEASUREMENT",
    "MTA54@1:SCI:BELL",
    "MTA54@1:SCI:PROBABILITY",
    "MTA54@1:ETH:IS_OUGHT",
    "MTA54@1:ETH:MORAL_REALISM",
    "MTA54@1:ETH:EUTHYPHRO",
    "MTA54@1:ETH:RIGHTS_OUTCOMES",
    "MTA54@1:ETH:POPULATION",
    "MTA54@1:ETH:RESPONSIBILITY",
    "MTA54@1:POL:LEGITIMACY",
    "MTA54@1:POL:LIBERTY_EQUALITY",
    "MTA54@1:POL:DISTRIBUTION",
    "MTA54@1:POL:COLLECTIVE_ACTION",
    "MTA54@1:POL:POWER",
    "MTA54@1:POL:REPRESENTATION",
    "MTA54@1:AXI:PLURALISM",
    "MTA54@1:AXI:BEAUTY",
    "MTA54@1:AXI:ART",
    "MTA54@1:AXI:MEANING",
    "MTA54@1:AXI:SUFFERING",
    "MTA54@1:AXI:DEATH",
    "MTA54@1:ULT:NECESSARY_BEING",
    "MTA54@1:ULT:EVIL",
    "MTA54@1:ULT:HIDDENNESS",
    "MTA54@1:ULT:PLURALISM",
    "MTA54@1:ULT:MYSTICAL",
    "MTA54@1:ULT:NONDUALITY"
  ],
  "collision_order": [
    "TCX-01",
    "TCX-02",
    "TCX-03",
    "TCX-04",
    "TCX-05",
    "TCX-06",
    "TCX-07",
    "TCX-08",
    "TCX-09",
    "TCX-10",
    "TCX-11",
    "TCX-12"
  ],
  "public_output_map": {
    "diagnoses_page": "12_PUBLIC_SITE/questions/diagnoses/index.html",
    "collisions_json": "12_PUBLIC_SITE/questions/collisions.json",
    "diagnoses_json": "12_PUBLIC_SITE/questions/diagnoses.json",
    "corpus_json": "12_PUBLIC_SITE/questions/fourth-churning.json",
    "collision_schema": "12_PUBLIC_SITE/questions/schemas/TypeCollision.v1.schema.json",
    "diagnosis_schema": "12_PUBLIC_SITE/questions/schemas/MysteryDiagnosis.v1.schema.json",
    "corpus_schema": "12_PUBLIC_SITE/questions/schemas/FourthChurningCorpus.v1.schema.json"
  },
  "candidate_counts": {
    "TYPE_COLLISION": 1,
    "PARTIAL_TYPE_COLLISION": 46,
    "NO_COLLISION": 2,
    "UNDERDETERMINED": 5
  },
  "pqa_state": {
    "selected": 54,
    "evaluated": 0,
    "independently_reviewed": 0,
    "resolved": 0
  },
  "held_out_integrity": "CONTAMINATED_FOR_FOURTH_USE",
  "global_philosophy_claim_allowed": false,
  "external_states": {
    "deployed": false,
    "native_reviewed": false,
    "empirically_validated": false,
    "training_inclusion_guaranteed": false
  }
}
